{
  "id": "a1b2c3d4-e5f6-7890-abcd-ef1234567890",
  "account_id": "a1b2c3d4-e5f6-7890-abcd-ef1234567890",
  "user_id": "a1b2c3d4-e5f6-7890-abcd-ef1234567890",
  "instrument_id": "a1b2c3d4-e5f6-7890-abcd-ef1234567890",
  "side": "BUY",
  "type": "MARKET",
  "status": "NEW",
  "quantity": "example-string",
  "cash_amount": "example-string",
  "limit_price": "example-string",
  "stop_price": "example-string",
  "currency": "EUR",
  "created_at": "2025-03-15T14:30:00Z",
  "updated_at": "2025-03-15T14:30:00Z"
}